cpf,id_transacao,tipo_transacao,data_hora,descricao,valor
255.341.928-32,TX-20250701123248-3927,TED,2025-07-01 12:32:48,TED para Serviços Online,-814.49
103.413.164-75,TX-20250701123407-8451,PIX_RECEBIDO,2025-07-01 12:34:07,Recebimento via PIX de Maria Souza,31.14
001.338.908-38,TX-20250701145231-2729,TRANSFERENCIA_SAIDA,2025-07-01 14:52:31,Transferência para conta João Silva,-170.73
764.835.030-56,TX-20250701153936-2638,DEPOSITO,2025-07-01 15:39:36,Depósito em caixa eletrônico,84.78
123.456.789-00,TX-20250701160215-4521,PIX_ENVIADO,2025-07-01 16:02:15,PIX para Ana Costa,-250.00
987.654.321-11,TX-20250701171045-7893,SAQUE,2025-07-01 17:10:45,Saque em caixa eletrônico,-100.00
456.789.123-22,TX-20250701183022-1456,COMPRA_DEBITO,2025-07-01 18:30:22,Compra no Supermercado ABC,-89.67
321.654.987-33,TX-20250701194511-9876,TRANSFERENCIA_RECEBIDA,2025-07-01 19:45:11,Transferência recebida de Pedro Lima,500.00